{
  "author": "Typefu",
  "category": "search",
  "icon": "magnifyingglass",
  "id": "com.typefu.search-kagi",
  "kind": "url",
  "name": "Kagi",
  "output": "none",
  "schemaVersion": 1,
  "script": "https://kagi.com/search?q={text}",
  "summary": "Searches Kagi for the selection.",
  "version": "1.0.0"
}
