{
  "author": "Typefu",
  "category": "text",
  "icon": "sum",
  "id": "sum-numbers",
  "kind": "javaScript",
  "name": "Sum Numbers",
  "output": "show",
  "schemaVersion": 1,
  "script": "const numbers = text.match(/-?\\d+(?:\\.\\d+)?/g) || []\nreturn String(numbers.reduce((sum, n) => sum + parseFloat(n), 0))",
  "summary": "Adds up every number in the selection.",
  "version": "1.0.0"
}
