{
  "author": "Typefu",
  "category": "apps",
  "icon": "square.and.pencil",
  "id": "drafts-create",
  "kind": "url",
  "name": "New Draft",
  "output": "none",
  "schemaVersion": 1,
  "script": "drafts://x-callback-url/create?text={text}",
  "summary": "Creates a draft in Drafts with the selection.",
  "version": "1.0.0"
}
