{
  "author": "Typefu",
  "category": "reference",
  "icon": "character.book.closed",
  "id": "merriam-webster",
  "kind": "url",
  "name": "Merriam-Webster",
  "output": "none",
  "requirements": {
    "maxLength": 40
  },
  "schemaVersion": 1,
  "script": "https://www.merriam-webster.com/dictionary/{text}",
  "summary": "Looks up a word in Merriam-Webster.",
  "version": "1.0.0"
}
