{
  "author": "Typefu",
  "category": "developer",
  "icon": "checkmark.seal",
  "id": "validate-json",
  "kind": "javaScript",
  "name": "Validate JSON",
  "output": "show",
  "schemaVersion": 1,
  "script": "try {\n  JSON.parse(text)\n  return \"Valid JSON\"\n} catch (error) {\n  return \"Invalid JSON: \" + error.message\n}",
  "summary": "Checks whether the selection is valid JSON.",
  "version": "1.0.0"
}
