{
  "author": "Typefu",
  "category": "search",
  "icon": "magnifyingglass",
  "id": "com.typefu.search-bing",
  "kind": "url",
  "name": "Bing",
  "output": "none",
  "schemaVersion": 1,
  "script": "https://www.bing.com/search?q={text}",
  "summary": "Searches Bing for the selection.",
  "version": "1.0.0"
}
