{
  "author": "Typefu",
  "category": "search",
  "icon": "bubble.left.and.bubble.right",
  "id": "search-reddit",
  "kind": "url",
  "name": "Reddit",
  "output": "none",
  "schemaVersion": 1,
  "script": "https://www.reddit.com/search/?q={text}",
  "summary": "Searches Reddit for the selection.",
  "version": "1.0.0"
}
